{
  "skill": "implement",
  "suite": "canary",
  "description": "Structural discovery and specific obsolete-rule regression checks only. Not a behavioral score; old phrase-presence scores are not comparable.",
  "cases": [
    {
      "id": "implement-discovery",
      "split": "canary",
      "prompt": "Load the skill metadata.",
      "expected_behavior": "Skill retains its declared identity and description.",
      "checks": [
        {
          "id": "identity",
          "type": "frontmatter_name",
          "value": "implement",
          "hard": true,
          "weight": 1
        },
        {
          "id": "description",
          "type": "contains_all",
          "tokens": [
            "description:"
          ],
          "hard": true,
          "weight": 1
        }
      ]
    },
    {
      "id": "implement-obsolete-gates",
      "split": "canary",
      "prompt": "Check known obsolete rule text is not reintroduced.",
      "expected_behavior": "No old mandatory gate phrases; behavioral review is separate.",
      "checks": [
        {
          "id": "obsolete-text",
          "type": "not_contains_any",
          "tokens": [
            "ready claim 只能由 `verify` 证明",
            "Ready claim: not made; route to verify"
          ],
          "hard": true,
          "weight": 1
        }
      ]
    }
  ]
}
