{
  "skill": "plan",
  "suite": "canary",
  "description": "Structural discovery and specific obsolete-rule regression checks only. Not a behavioral score; old phrase-presence scores are not comparable.",
  "cases": [
    {
      "id": "plan-discovery",
      "split": "canary",
      "prompt": "Load the skill metadata.",
      "expected_behavior": "Skill retains its declared identity and description.",
      "checks": [
        {
          "id": "identity",
          "type": "frontmatter_name",
          "value": "plan",
          "hard": true,
          "weight": 1
        },
        {
          "id": "description",
          "type": "contains_all",
          "tokens": [
            "description:"
          ],
          "hard": true,
          "weight": 1
        }
      ]
    },
    {
      "id": "plan-obsolete-gates",
      "split": "canary",
      "prompt": "Check known obsolete rule text is not reintroduced.",
      "expected_behavior": "No old mandatory gate phrases; behavioral review is separate.",
      "checks": [
        {
          "id": "obsolete-text",
          "type": "not_contains_any",
          "tokens": [
            "先把 Work Index 旧 `active` 标为",
            "除非用户明确要求继续，否则写完计划后停"
          ],
          "hard": true,
          "weight": 1
        }
      ]
    }
  ]
}
