{
  "skill": "brainstorm",
  "suite": "canary",
  "description": "Structural discovery and specific obsolete-rule regression checks only. Not a behavioral score; old phrase-presence scores are not comparable.",
  "cases": [
    {
      "id": "brainstorm-discovery",
      "split": "canary",
      "prompt": "Load the skill metadata.",
      "expected_behavior": "Skill retains its declared identity and description.",
      "checks": [
        {
          "id": "identity",
          "type": "frontmatter_name",
          "value": "brainstorm",
          "hard": true,
          "weight": 1
        },
        {
          "id": "description",
          "type": "contains_all",
          "tokens": [
            "description:"
          ],
          "hard": true,
          "weight": 1
        }
      ]
    },
    {
      "id": "brainstorm-obsolete-gates",
      "split": "canary",
      "prompt": "Check known obsolete rule text is not reintroduced.",
      "expected_behavior": "No old mandatory gate phrases; behavioral review is separate.",
      "checks": [
        {
          "id": "obsolete-text",
          "type": "not_contains_any",
          "tokens": [
            "Gate 通过前禁止写 Spec",
            "每轮只问一个最高优先级问题",
            "至少 2 轮"
          ],
          "hard": true,
          "weight": 1
        }
      ]
    }
  ]
}
